[
  {
    "model_provider_id": 240,
    "model_id": "llama-3.1-70b-instruct",
    "provider_id": "sambanova",
    "deprecated_at": null,
    "input_cents_per_million_tokens": 500,
    "output_cents_per_million_tokens": 1000,
    "quantization": null,
    "max_input_tokens": 128000,
    "max_output_tokens": 128000,
    "throughput": 74.0,
    "latency": 0.5,
    "feature_web_search": false,
    "feature_function_calling": true,
    "feature_structured_output": true,
    "feature_code_execution": false,
    "feature_batch_inference": true,
    "feature_finetuning": false,
    "input_modality_text": true,
    "input_modality_image": false,
    "input_modality_audio": false,
    "input_modality_video": false,
    "output_modality_text": true,
    "output_modality_image": false,
    "output_modality_audio": false,
    "output_modality_video": false,
    "created_at": "2025-07-19T19:49:16.702554+00:00",
    "updated_at": "2025-07-19T19:49:16.702554+00:00",
    "provider_model_id_used": "llama-3.1-70b-instruct",
    "model_name": "Llama 3.1 70B Instruct",
    "organization_id": "meta"
  },
  {
    "model_provider_id": 239,
    "model_id": "llama-3.1-8b-instruct",
    "provider_id": "sambanova",
    "deprecated_at": null,
    "input_cents_per_million_tokens": 10,
    "output_cents_per_million_tokens": 20,
    "quantization": null,
    "max_input_tokens": 131072,
    "max_output_tokens": 131072,
    "throughput": 1050.0,
    "latency": 0.5,
    "feature_web_search": false,
    "feature_function_calling": true,
    "feature_structured_output": true,
    "feature_code_execution": false,
    "feature_batch_inference": true,
    "feature_finetuning": false,
    "input_modality_text": true,
    "input_modality_image": false,
    "input_modality_audio": false,
    "input_modality_video": false,
    "output_modality_text": true,
    "output_modality_image": false,
    "output_modality_audio": false,
    "output_modality_video": false,
    "created_at": "2025-07-19T19:49:16.699627+00:00",
    "updated_at": "2025-07-19T19:49:16.699627+00:00",
    "provider_model_id_used": "llama-3.1-8b-instruct",
    "model_name": "Llama 3.1 8B Instruct",
    "organization_id": "meta"
  },
  {
    "model_provider_id": 241,
    "model_id": "llama-3.2-11b-instruct",
    "provider_id": "sambanova",
    "deprecated_at": null,
    "input_cents_per_million_tokens": 15,
    "output_cents_per_million_tokens": 30,
    "quantization": null,
    "max_input_tokens": 128000,
    "max_output_tokens": 128000,
    "throughput": 100.0,
    "latency": 0.5,
    "feature_web_search": false,
    "feature_function_calling": true,
    "feature_structured_output": true,
    "feature_code_execution": false,
    "feature_batch_inference": true,
    "feature_finetuning": false,
    "input_modality_text": true,
    "input_modality_image": true,
    "input_modality_audio": false,
    "input_modality_video": false,
    "output_modality_text": true,
    "output_modality_image": false,
    "output_modality_audio": false,
    "output_modality_video": false,
    "created_at": "2025-07-19T19:49:16.705086+00:00",
    "updated_at": "2025-07-19T19:49:16.705086+00:00",
    "provider_model_id_used": "llama-3.2-11b-instruct",
    "model_name": "Llama 3.2 11B Instruct",
    "organization_id": "meta"
  },
  {
    "model_provider_id": 242,
    "model_id": "llama-3.3-70b-instruct",
    "provider_id": "sambanova",
    "deprecated_at": null,
    "input_cents_per_million_tokens": 60,
    "output_cents_per_million_tokens": 120,
    "quantization": null,
    "max_input_tokens": 128000,
    "max_output_tokens": 128000,
    "throughput": 1096.0,
    "latency": 0.65,
    "feature_web_search": false,
    "feature_function_calling": true,
    "feature_structured_output": true,
    "feature_code_execution": false,
    "feature_batch_inference": true,
    "feature_finetuning": false,
    "input_modality_text": true,
    "input_modality_image": false,
    "input_modality_audio": false,
    "input_modality_video": false,
    "output_modality_text": true,
    "output_modality_image": false,
    "output_modality_audio": false,
    "output_modality_video": false,
    "created_at": "2025-07-19T19:49:16.707534+00:00",
    "updated_at": "2025-07-19T19:49:16.707534+00:00",
    "provider_model_id_used": "llama-3.3-70b-instruct",
    "model_name": "Llama 3.3 70B Instruct",
    "organization_id": "meta"
  },
  {
    "model_provider_id": 243,
    "model_id": "llama-4-maverick",
    "provider_id": "sambanova",
    "deprecated_at": null,
    "input_cents_per_million_tokens": 63,
    "output_cents_per_million_tokens": 179,
    "quantization": null,
    "max_input_tokens": 1000000,
    "max_output_tokens": 1000000,
    "throughput": 638.7,
    "latency": 2.04,
    "feature_web_search": false,
    "feature_function_calling": true,
    "feature_structured_output": true,
    "feature_code_execution": false,
    "feature_batch_inference": true,
    "feature_finetuning": false,
    "input_modality_text": true,
    "input_modality_image": true,
    "input_modality_audio": false,
    "input_modality_video": false,
    "output_modality_text": true,
    "output_modality_image": false,
    "output_modality_audio": false,
    "output_modality_video": false,
    "created_at": "2025-07-19T19:49:16.710100+00:00",
    "updated_at": "2025-07-19T19:49:16.710100+00:00",
    "provider_model_id_used": "llama-4-maverick",
    "model_name": "Llama 4 Maverick",
    "organization_id": "meta"
  },
  {
    "model_provider_id": 244,
    "model_id": "qwen3-32b",
    "provider_id": "sambanova",
    "deprecated_at": null,
    "input_cents_per_million_tokens": 40,
    "output_cents_per_million_tokens": 80,
    "quantization": null,
    "max_input_tokens": 128000,
    "max_output_tokens": 128000,
    "throughput": 327.7,
    "latency": 1.08,
    "feature_web_search": false,
    "feature_function_calling": true,
    "feature_structured_output": true,
    "feature_code_execution": false,
    "feature_batch_inference": true,
    "feature_finetuning": false,
    "input_modality_text": true,
    "input_modality_image": false,
    "input_modality_audio": false,
    "input_modality_video": false,
    "output_modality_text": true,
    "output_modality_image": false,
    "output_modality_audio": false,
    "output_modality_video": false,
    "created_at": "2025-07-19T19:49:16.712669+00:00",
    "updated_at": "2025-07-19T19:49:16.712669+00:00",
    "provider_model_id_used": "qwen3-32b",
    "model_name": "Qwen3 32B",
    "organization_id": "qwen"
  }
]