[
  {
    "model_provider_id": 396,
    "model_id": "deepseek-vl2",
    "provider_id": "replicate",
    "deprecated_at": null,
    "input_cents_per_million_tokens": 950,
    "output_cents_per_million_tokens": 480000,
    "quantization": null,
    "max_input_tokens": 129280,
    "max_output_tokens": 129280,
    "throughput": 22.0,
    "latency": 0.5,
    "feature_web_search": false,
    "feature_function_calling": true,
    "feature_structured_output": true,
    "feature_code_execution": false,
    "feature_batch_inference": true,
    "feature_finetuning": false,
    "input_modality_text": true,
    "input_modality_image": true,
    "input_modality_audio": false,
    "input_modality_video": false,
    "output_modality_text": true,
    "output_modality_image": false,
    "output_modality_audio": false,
    "output_modality_video": false,
    "created_at": "2025-07-19T19:49:17.068077+00:00",
    "updated_at": "2025-07-19T19:49:17.068077+00:00",
    "provider_model_id_used": "deepseek-vl2",
    "model_name": "DeepSeek VL2",
    "organization_id": "deepseek"
  },
  {
    "model_provider_id": 395,
    "model_id": "llama-3.1-405b-instruct",
    "provider_id": "replicate",
    "deprecated_at": null,
    "input_cents_per_million_tokens": 950,
    "output_cents_per_million_tokens": 950,
    "quantization": null,
    "max_input_tokens": 128000,
    "max_output_tokens": 128000,
    "throughput": 22.0,
    "latency": 0.5,
    "feature_web_search": false,
    "feature_function_calling": true,
    "feature_structured_output": true,
    "feature_code_execution": false,
    "feature_batch_inference": true,
    "feature_finetuning": false,
    "input_modality_text": true,
    "input_modality_image": false,
    "input_modality_audio": false,
    "input_modality_video": false,
    "output_modality_text": true,
    "output_modality_image": false,
    "output_modality_audio": false,
    "output_modality_video": false,
    "created_at": "2025-07-19T19:49:17.066199+00:00",
    "updated_at": "2025-07-19T19:49:17.066199+00:00",
    "provider_model_id_used": "llama-3.1-405b-instruct",
    "model_name": "Llama 3.1 405B Instruct",
    "organization_id": "meta"
  }
]