[
  {
    "model_provider_id": 405,
    "model_id": "llama-3.1-70b-instruct",
    "provider_id": "cerebras",
    "deprecated_at": null,
    "input_cents_per_million_tokens": 60,
    "output_cents_per_million_tokens": 60,
    "quantization": null,
    "max_input_tokens": 128000,
    "max_output_tokens": 128000,
    "throughput": 1204.0,
    "latency": 0.2,
    "feature_web_search": false,
    "feature_function_calling": true,
    "feature_structured_output": true,
    "feature_code_execution": false,
    "feature_batch_inference": true,
    "feature_finetuning": false,
    "input_modality_text": true,
    "input_modality_image": false,
    "input_modality_audio": false,
    "input_modality_video": false,
    "output_modality_text": true,
    "output_modality_image": false,
    "output_modality_audio": false,
    "output_modality_video": false,
    "created_at": "2025-07-19T19:49:17.090362+00:00",
    "updated_at": "2025-07-19T19:49:17.090362+00:00",
    "provider_model_id_used": "llama-3.1-70b-instruct",
    "model_name": "Llama 3.1 70B Instruct",
    "organization_id": "meta"
  },
  {
    "model_provider_id": 406,
    "model_id": "llama-3.1-8b-instruct",
    "provider_id": "cerebras",
    "deprecated_at": null,
    "input_cents_per_million_tokens": 10,
    "output_cents_per_million_tokens": 10,
    "quantization": null,
    "max_input_tokens": 131072,
    "max_output_tokens": 131072,
    "throughput": 2047.0,
    "latency": 0.2,
    "feature_web_search": false,
    "feature_function_calling": true,
    "feature_structured_output": true,
    "feature_code_execution": false,
    "feature_batch_inference": true,
    "feature_finetuning": false,
    "input_modality_text": true,
    "input_modality_image": false,
    "input_modality_audio": false,
    "input_modality_video": false,
    "output_modality_text": true,
    "output_modality_image": false,
    "output_modality_audio": false,
    "output_modality_video": false,
    "created_at": "2025-07-19T19:49:17.092709+00:00",
    "updated_at": "2025-07-19T19:49:17.092709+00:00",
    "provider_model_id_used": "llama-3.1-8b-instruct",
    "model_name": "Llama 3.1 8B Instruct",
    "organization_id": "meta"
  },
  {
    "model_provider_id": 407,
    "model_id": "llama-3.3-70b-instruct",
    "provider_id": "cerebras",
    "deprecated_at": null,
    "input_cents_per_million_tokens": 70,
    "output_cents_per_million_tokens": 80,
    "quantization": null,
    "max_input_tokens": 128000,
    "max_output_tokens": 128000,
    "throughput": 2220.0,
    "latency": 0.65,
    "feature_web_search": false,
    "feature_function_calling": true,
    "feature_structured_output": true,
    "feature_code_execution": false,
    "feature_batch_inference": true,
    "feature_finetuning": false,
    "input_modality_text": true,
    "input_modality_image": false,
    "input_modality_audio": false,
    "input_modality_video": false,
    "output_modality_text": true,
    "output_modality_image": false,
    "output_modality_audio": false,
    "output_modality_video": false,
    "created_at": "2025-07-19T19:49:17.095252+00:00",
    "updated_at": "2025-07-19T19:49:17.095252+00:00",
    "provider_model_id_used": "llama-3.3-70b-instruct",
    "model_name": "Llama 3.3 70B Instruct",
    "organization_id": "meta"
  }
]