[
  {
    "model_provider_id": 363,
    "model_id": "grok-2",
    "provider_id": "xai",
    "deprecated_at": null,
    "input_cents_per_million_tokens": 200,
    "output_cents_per_million_tokens": 1000,
    "quantization": null,
    "max_input_tokens": 128000,
    "max_output_tokens": 8000,
    "throughput": 85.0,
    "latency": 0.7,
    "feature_web_search": false,
    "feature_function_calling": true,
    "feature_structured_output": true,
    "feature_code_execution": false,
    "feature_batch_inference": true,
    "feature_finetuning": false,
    "input_modality_text": true,
    "input_modality_image": true,
    "input_modality_audio": false,
    "input_modality_video": false,
    "output_modality_text": true,
    "output_modality_image": false,
    "output_modality_audio": false,
    "output_modality_video": false,
    "created_at": "2025-07-19T19:49:16.997220+00:00",
    "updated_at": "2025-07-19T19:49:16.997220+00:00",
    "provider_model_id_used": "grok-2",
    "model_name": "Grok-2",
    "organization_id": "xai"
  },
  {
    "model_provider_id": 364,
    "model_id": "grok-3",
    "provider_id": "xai",
    "deprecated_at": null,
    "input_cents_per_million_tokens": 300,
    "output_cents_per_million_tokens": 1500,
    "quantization": null,
    "max_input_tokens": 128000,
    "max_output_tokens": 8000,
    "throughput": 100.0,
    "latency": 0.7,
    "feature_web_search": false,
    "feature_function_calling": true,
    "feature_structured_output": true,
    "feature_code_execution": false,
    "feature_batch_inference": true,
    "feature_finetuning": false,
    "input_modality_text": true,
    "input_modality_image": true,
    "input_modality_audio": false,
    "input_modality_video": false,
    "output_modality_text": true,
    "output_modality_image": false,
    "output_modality_audio": false,
    "output_modality_video": false,
    "created_at": "2025-07-19T19:49:16.998872+00:00",
    "updated_at": "2025-07-19T19:49:16.998872+00:00",
    "provider_model_id_used": "grok-3",
    "model_name": "Grok-3",
    "organization_id": "xai"
  },
  {
    "model_provider_id": 365,
    "model_id": "grok-3-mini",
    "provider_id": "xai",
    "deprecated_at": null,
    "input_cents_per_million_tokens": 30,
    "output_cents_per_million_tokens": 50,
    "quantization": null,
    "max_input_tokens": 128000,
    "max_output_tokens": 8000,
    "throughput": 100.0,
    "latency": 0.7,
    "feature_web_search": false,
    "feature_function_calling": true,
    "feature_structured_output": true,
    "feature_code_execution": false,
    "feature_batch_inference": true,
    "feature_finetuning": false,
    "input_modality_text": true,
    "input_modality_image": true,
    "input_modality_audio": false,
    "input_modality_video": false,
    "output_modality_text": true,
    "output_modality_image": false,
    "output_modality_audio": false,
    "output_modality_video": false,
    "created_at": "2025-07-19T19:49:17.000676+00:00",
    "updated_at": "2025-07-19T19:49:17.000676+00:00",
    "provider_model_id_used": "grok-3-mini",
    "model_name": "Grok-3 Mini",
    "organization_id": "xai"
  },
  {
    "model_provider_id": 366,
    "model_id": "grok-4",
    "provider_id": "xai",
    "deprecated_at": null,
    "input_cents_per_million_tokens": 300,
    "output_cents_per_million_tokens": 1500,
    "quantization": null,
    "max_input_tokens": 256000,
    "max_output_tokens": 8000,
    "throughput": 100.0,
    "latency": 0.7,
    "feature_web_search": false,
    "feature_function_calling": true,
    "feature_structured_output": true,
    "feature_code_execution": false,
    "feature_batch_inference": true,
    "feature_finetuning": false,
    "input_modality_text": true,
    "input_modality_image": true,
    "input_modality_audio": false,
    "input_modality_video": false,
    "output_modality_text": true,
    "output_modality_image": false,
    "output_modality_audio": false,
    "output_modality_video": false,
    "created_at": "2025-07-19T19:49:17.002399+00:00",
    "updated_at": "2025-07-19T19:49:17.002399+00:00",
    "provider_model_id_used": "grok-4",
    "model_name": "Grok-4",
    "organization_id": "xai"
  }
]