[
  {
    "model_provider_id": 357,
    "model_id": "deepseek-r1-0528",
    "provider_id": "novita",
    "deprecated_at": null,
    "input_cents_per_million_tokens": 70,
    "output_cents_per_million_tokens": 250,
    "quantization": null,
    "max_input_tokens": 131072,
    "max_output_tokens": 131072,
    "throughput": 37.96,
    "latency": 1.18,
    "feature_web_search": false,
    "feature_function_calling": true,
    "feature_structured_output": true,
    "feature_code_execution": false,
    "feature_batch_inference": true,
    "feature_finetuning": false,
    "input_modality_text": true,
    "input_modality_image": false,
    "input_modality_audio": false,
    "input_modality_video": false,
    "output_modality_text": true,
    "output_modality_image": false,
    "output_modality_audio": false,
    "output_modality_video": false,
    "created_at": "2025-07-19T19:49:16.982118+00:00",
    "updated_at": "2025-07-19T19:49:16.982118+00:00",
    "provider_model_id_used": "deepseek-r1-0528",
    "model_name": "DeepSeek-R1-0528",
    "organization_id": "deepseek"
  },
  {
    "model_provider_id": 351,
    "model_id": "gemma-3-27b-it",
    "provider_id": "novita",
    "deprecated_at": null,
    "input_cents_per_million_tokens": 11,
    "output_cents_per_million_tokens": 20,
    "quantization": null,
    "max_input_tokens": 131072,
    "max_output_tokens": 131072,
    "throughput": 33.0,
    "latency": 0.2,
    "feature_web_search": false,
    "feature_function_calling": true,
    "feature_structured_output": true,
    "feature_code_execution": false,
    "feature_batch_inference": true,
    "feature_finetuning": false,
    "input_modality_text": true,
    "input_modality_image": true,
    "input_modality_audio": false,
    "input_modality_video": false,
    "output_modality_text": true,
    "output_modality_image": false,
    "output_modality_audio": false,
    "output_modality_video": false,
    "created_at": "2025-07-19T19:49:16.969199+00:00",
    "updated_at": "2025-07-19T19:49:16.969199+00:00",
    "provider_model_id_used": "gemma-3-27b-it",
    "model_name": "Gemma 3 27B",
    "organization_id": "google"
  },
  {
    "model_provider_id": 358,
    "model_id": "kimi-k2-instruct",
    "provider_id": "novita",
    "deprecated_at": null,
    "input_cents_per_million_tokens": 57,
    "output_cents_per_million_tokens": 229,
    "quantization": null,
    "max_input_tokens": 128000,
    "max_output_tokens": 16000,
    "throughput": 45.0,
    "latency": 0.95,
    "feature_web_search": false,
    "feature_function_calling": true,
    "feature_structured_output": true,
    "feature_code_execution": false,
    "feature_batch_inference": true,
    "feature_finetuning": false,
    "input_modality_text": true,
    "input_modality_image": false,
    "input_modality_audio": false,
    "input_modality_video": false,
    "output_modality_text": true,
    "output_modality_image": false,
    "output_modality_audio": false,
    "output_modality_video": false,
    "created_at": "2025-07-19T19:49:16.984536+00:00",
    "updated_at": "2025-07-19T19:49:16.984536+00:00",
    "provider_model_id_used": "kimi-k2-instruct",
    "model_name": "Kimi K2 Instruct",
    "organization_id": "moonshotai"
  },
  {
    "model_provider_id": 352,
    "model_id": "llama-4-maverick",
    "provider_id": "novita",
    "deprecated_at": null,
    "input_cents_per_million_tokens": 17,
    "output_cents_per_million_tokens": 85,
    "quantization": null,
    "max_input_tokens": 1000000,
    "max_output_tokens": 1000000,
    "throughput": 69.42,
    "latency": 0.62,
    "feature_web_search": false,
    "feature_function_calling": true,
    "feature_structured_output": true,
    "feature_code_execution": false,
    "feature_batch_inference": true,
    "feature_finetuning": false,
    "input_modality_text": true,
    "input_modality_image": true,
    "input_modality_audio": false,
    "input_modality_video": false,
    "output_modality_text": true,
    "output_modality_image": false,
    "output_modality_audio": false,
    "output_modality_video": false,
    "created_at": "2025-07-19T19:49:16.970871+00:00",
    "updated_at": "2025-07-19T19:49:16.970871+00:00",
    "provider_model_id_used": "llama-4-maverick",
    "model_name": "Llama 4 Maverick",
    "organization_id": "meta"
  },
  {
    "model_provider_id": 353,
    "model_id": "llama-4-scout",
    "provider_id": "novita",
    "deprecated_at": null,
    "input_cents_per_million_tokens": 10,
    "output_cents_per_million_tokens": 50,
    "quantization": null,
    "max_input_tokens": 10000000,
    "max_output_tokens": 10000000,
    "throughput": 69.82,
    "latency": 0.85,
    "feature_web_search": false,
    "feature_function_calling": true,
    "feature_structured_output": true,
    "feature_code_execution": false,
    "feature_batch_inference": true,
    "feature_finetuning": false,
    "input_modality_text": true,
    "input_modality_image": true,
    "input_modality_audio": false,
    "input_modality_video": false,
    "output_modality_text": true,
    "output_modality_image": false,
    "output_modality_audio": false,
    "output_modality_video": false,
    "created_at": "2025-07-19T19:49:16.972719+00:00",
    "updated_at": "2025-07-19T19:49:16.972719+00:00",
    "provider_model_id_used": "llama-4-scout",
    "model_name": "Llama 4 Scout",
    "organization_id": "meta"
  },
  {
    "model_provider_id": 354,
    "model_id": "qwen3-235b-a22b",
    "provider_id": "novita",
    "deprecated_at": null,
    "input_cents_per_million_tokens": 20,
    "output_cents_per_million_tokens": 80,
    "quantization": null,
    "max_input_tokens": 128000,
    "max_output_tokens": 128000,
    "throughput": 38.51,
    "latency": 1.02,
    "feature_web_search": false,
    "feature_function_calling": true,
    "feature_structured_output": true,
    "feature_code_execution": false,
    "feature_batch_inference": true,
    "feature_finetuning": false,
    "input_modality_text": true,
    "input_modality_image": false,
    "input_modality_audio": false,
    "input_modality_video": false,
    "output_modality_text": true,
    "output_modality_image": false,
    "output_modality_audio": false,
    "output_modality_video": false,
    "created_at": "2025-07-19T19:49:16.975233+00:00",
    "updated_at": "2025-07-19T19:49:16.975233+00:00",
    "provider_model_id_used": "qwen3-235b-a22b",
    "model_name": "Qwen3 235B A22B",
    "organization_id": "qwen"
  },
  {
    "model_provider_id": 356,
    "model_id": "qwen3-30b-a3b",
    "provider_id": "novita",
    "deprecated_at": null,
    "input_cents_per_million_tokens": 10,
    "output_cents_per_million_tokens": 44,
    "quantization": null,
    "max_input_tokens": 128000,
    "max_output_tokens": 128000,
    "throughput": 88.84,
    "latency": 0.73,
    "feature_web_search": false,
    "feature_function_calling": true,
    "feature_structured_output": true,
    "feature_code_execution": false,
    "feature_batch_inference": true,
    "feature_finetuning": false,
    "input_modality_text": true,
    "input_modality_image": false,
    "input_modality_audio": false,
    "input_modality_video": false,
    "output_modality_text": true,
    "output_modality_image": false,
    "output_modality_audio": false,
    "output_modality_video": false,
    "created_at": "2025-07-19T19:49:16.980126+00:00",
    "updated_at": "2025-07-19T19:49:16.980126+00:00",
    "provider_model_id_used": "qwen3-30b-a3b",
    "model_name": "Qwen3 30B A3B",
    "organization_id": "qwen"
  },
  {
    "model_provider_id": 355,
    "model_id": "qwen3-32b",
    "provider_id": "novita",
    "deprecated_at": null,
    "input_cents_per_million_tokens": 10,
    "output_cents_per_million_tokens": 44,
    "quantization": null,
    "max_input_tokens": 128000,
    "max_output_tokens": 128000,
    "throughput": 32.43,
    "latency": 0.93,
    "feature_web_search": false,
    "feature_function_calling": true,
    "feature_structured_output": true,
    "feature_code_execution": false,
    "feature_batch_inference": true,
    "feature_finetuning": false,
    "input_modality_text": true,
    "input_modality_image": false,
    "input_modality_audio": false,
    "input_modality_video": false,
    "output_modality_text": true,
    "output_modality_image": false,
    "output_modality_audio": false,
    "output_modality_video": false,
    "created_at": "2025-07-19T19:49:16.977464+00:00",
    "updated_at": "2025-07-19T19:49:16.977464+00:00",
    "provider_model_id_used": "qwen3-32b",
    "model_name": "Qwen3 32B",
    "organization_id": "qwen"
  }
]